{
  "request": {
    "operation": "create",
    "requestId": "req-example-0001"
  },
  "buildingBlock": {
    "name": "subnet",
    "version": "0.1.0"
  },
  "context": {
    "applicationId": "APP-1234",
    "environment": "dev",
    "platform": "aws",
    "costCenter": "example-cost-center",
    "dataClassification": "internal",
    "requesterIdentity": "svc-example-caller",
    "correlationId": "corr-example-0001"
  },
  "requirements": {
    "sizing": {
      "cidrBlock": "10.0.1.0/24"
    },
    "access": {
      "networkExposure": "private"
    },
    "resilience": {
      "availabilityZoneIndex": 0
    },
    "security": {
      "networkAclProfile": "default"
    },
    "operations": {
      "parentNetworkId": "vpc-0123456789abcdef0"
    }
  }
}
